### ISSUE TITLE
"No proxy for" addresses seem to be ignored

### ISSUE THREAD

**Issue by GoogleCodeExporter** [FelisCatus/switchy#92]
```
What steps will reproduce the problem?
1. Setup a proxy with "manual configuration" and leave the default 
localhost exclude value or add other hosts ";" separated
2. Navigate on localhost or on the excluded hosts

What is the expected output?
The connection should bypass the proxy

What do you see instead?
Connections are still using the selected proxy

Switchy version: 1.6.0.1
Operating system: Ubuntu Linux  9.04 64bit


Error Log (Switchy Options > press 'Error Log' button):
[11:03:22] [info] - Extension Info: v1.6.0.1
[11:03:22] [info] - Browser Info: 5.0 (X11; U; Linux x86_64; en-US) 
AppleWebKit/532.9 (KHTML, like Gecko) Chrome/5.0.307.7 Safari/532.9
[14:14:53] [success] - Everything is OK

tcpdump browsing on localhost:

with proxy enabled:
root@max-ws:~# tcpdump -lnni lo dst 127.0.0.1 and port 80
tcpdump: verbose output suppressed, use -v or -vv for full protocol decode
listening on lo, link-type EN10MB (Ethernet), capture size 96 bytes
^C
0 packets captured
0 packets received by filter
0 packets dropped by kernel


without proxy, direct connection:
root@max-ws:~# tcpdump -lnni lo dst 127.0.0.1 and port 80
tcpdump: verbose output suppressed, use -v or -vv for full protocol decode
listening on lo, link-type EN10MB (Ethernet), capture size 96 bytes
14:20:33.885545 IP 127.0.0.1.41481 > 127.0.0.1.80: S 
2657919970:2657919970(0) win 32792 <mss 16396,sackOK,timestamp 687096692 
0,nop,wscale 7>
14:20:33.885559 IP 127.0.0.1.80 > 127.0.0.1.41481: S 
2657609980:2657609980(0) ack 2657919971 win 32768 <mss 
16396,sackOK,timestamp 687096692 687096692,nop,wscale 7>
14:20:33.885574 IP 127.0.0.1.41481 > 127.0.0.1.80: . ack 1 win 257 
<nop,nop,timestamp 687096692 687096692>
14:20:33.885632 IP 127.0.0.1.41481 > 127.0.0.1.80: P 1:535(534) ack 1 win 
257 <nop,nop,timestamp 687096692 687096692>
14:20:33.885655 IP 127.0.0.1.80 > 127.0.0.1.41481: . ack 535 win 265 
<nop,nop,timestamp 687096692 687096692>
14:20:34.292501 IP 127.0.0.1.80 > 127.0.0.1.41481: P 1:440(439) ack 535 win 
265 <nop,nop,timestamp 687096794 687096692>
14:20:34.292522 IP 127.0.0.1.41481 > 127.0.0.1.80: . ack 440 win 265 
<nop,nop,timestamp 687096794 687096794>
14:20:34.659748 IP 127.0.0.1.41481 > 127.0.0.1.80: P 535:870(335) ack 440 
win 265 <nop,nop,timestamp 687096886 687096794>
14:20:34.659768 IP 127.0.0.1.80 > 127.0.0.1.41481: . ack 870 win 273 
<nop,nop,timestamp 687096886 687096886>
14:20:34.660165 IP 127.0.0.1.80 > 127.0.0.1.41481: P 440:1007(567) ack 870 
win 273 <nop,nop,timestamp 687096886 687096886>
14:20:34.660177 IP 127.0.0.1.41481 > 127.0.0.1.80: . ack 1007 win 274 
<nop,nop,timestamp 687096886 687096886>



^C
11 packets captured
22 packets received by filter
0 packets dropped by kernel


```

Original issue reported on code.google.com by `massimo....@gmail.com` on 16 Feb 2010 at 2:23
